Data Permalink,Data,Metrics documentation link,Quick description,Metrics Name
https://api.coronavirus.data.gov.uk/v2/data?areaType=overview&metric=newDeaths28DaysByDeathDate&format=csv,Deaths within 28 days of positive test by date of death,https://coronavirus.data.gov.uk/metrics/doc/newDeaths28DaysByDeathDate,Daily numbers of people who died within 28 days of being identified as a COVID-19 case by a positive test. Data are shown by date of death.,newDeaths28DaysByDeathDate
https://api.coronavirus.data.gov.uk/v2/data?areaType=overview&metric=newDeaths28DaysByPublishDateRollingSum&format=csv,New deaths within 28 days of a positive test rolling sum by publish date,https://coronavirus.data.gov.uk/metrics/doc/newDeaths28DaysByPublishDateRollingSum,The number of people who died within 28 days of being identified as a COVID-19 case by a positive test in the rolling 7-day period ending on the dates shown. Data are shown by the date the figures appeared in the published totals.,newDeaths28DaysByPublishDateRollingSum
https://api.coronavirus.data.gov.uk/v2/data?areaType=overview&metric=newCasesBySpecimenDate&format=csv,New cases by specimen date,https://coronavirus.data.gov.uk/metrics/doc/newCasesBySpecimenDate,Daily numbers of new cases. Data are shown by the date the sample was taken from the person being tested./NLData for the most recent days are considered incomplete as it takes time for tests to have an outcome and be recorded on relevant lab systems.,newCasesBySpecimenDate
https://api.coronavirus.data.gov.uk/v2/data?areaType=overview&metric=newCasesBySpecimenDateRollingSum&format=csv,New cases by specimen date rolling sum,https://coronavirus.data.gov.uk/metrics/doc/newCasesBySpecimenDateRollingSum,The number of new cases within rolling 7-day periods. Data are shown by the date the sample was taken from the person being tested./NLData for the most recent days are considered incomplete as it takes time for tests to have an outcome and be recorded on relevant lab systems.,newCasesBySpecimenDateRollingSum
https://api.coronavirus.data.gov.uk/v2/data?areaType=overview&metric=cumDeaths28DaysByDeathDate&format=csv,Cumulative deaths within 28 days of a positive test by death date,https://coronavirus.data.gov.uk/metrics/doc/cumDeaths28DaysByDeathDate,Total number people who died within 28 days of being identified as a COVID-19 case by a positive test since the start of the pandemic. Data are shown by date of death.,cumDeaths28DaysByDeathDate
https://api.coronavirus.data.gov.uk/v2/data?areaType=overview&metric=cumCasesBySpecimenDate&format=csv,Cumulative cases by specimen date,https://coronavirus.data.gov.uk/metrics/doc/cumCasesBySpecimenDate,Total number of cases since the start of the pandemic. Data are shown by the date the sample was taken from the person being tested./NLData for the most recent days are considered incomplete as it takes time for tests to have an outcome and be recorded on relevant lab systems.,cumCasesBySpecimenDate
https://api.coronavirus.data.gov.uk/v2/data?areaType=overview&metric=newDailyNsoDeathsByDeathDate&format=csv,New daily national statistics office deaths by death date,https://coronavirus.data.gov.uk/metrics/doc/newDailyNsoDeathsByDeathDate,Daily numbers of deaths of people whose death certificate mentioned COVID-19 as one of the causes. Data are reported by date of death. There is a lag in reporting of at least 11 days because the data are based on death registrations.,newDailyNsoDeathsByDeathDate
